{
  "$schema": "https://raw.githubusercontent.com/wen-templari/nanoflare/main/schemas/nanoflare.json",
  "name": "api-worker",
  "main": "worker.js",
  "format": "modules",
  "compatibility_date": "2025-12-10",
  "files": ["worker.js"],
  "services": [
    {
      "binding": "IDENTITY",
      "service": "identity-worker"
    }
  ]
}
