{
  "$schema": "https://raw.githubusercontent.com/wen-templari/nanoflare/main/schemas/nanoflare.json",
  "name": "{{projectName}}",
  "main": "dist/worker.js",
  "compatibility_date": "{{compatibilityDate}}",
  "assets": {
    "binding": "ASSETS",
    "directory": "dist/client",
    "not_found_handling": "single-page-application",
    "run_worker_first": ["/api/*"]
  }
}
