{
  "$schema": "https://raw.githubusercontent.com/wen-templari/nanoflare/main/schemas/nanoflare.json",
  "name": "protected-app",
  "main": "dist/worker.js",
  "format": "modules",
  "compatibility_date": "2025-12-10",
  "files": ["dist/worker.js"],
  "auth": {
    "protected_routes": ["/api/auth/*"]
  }
}
