{
  "$schema": "https://raw.githubusercontent.com/wen-templari/nanoflare/main/schemas/nanoflare.json",
  "name": "simple-kv",
  "main": "dist/worker.js",
  "format": "modules",
  "compatibility_date": "2025-12-10",
  "files": ["dist/worker.js"],
  "kv_namespaces": [
    {
      "binding": "COUNTER_KV",
      "id": "replace-with-kv-namespace-id"
    }
  ]
}
